mention_id,source_platform,source_url,author_handle,posted_at,ingested_at,brand,category,product_model,text,rating,language,topic_id
gen-nin-0200-21a74c37,reddit,https://reddit.com/r/sharkninja/comments/gen200,u/GenUser200,2026-03-05T16:00:00Z,2026-03-05T19:00:00Z,ninja,air_fryer,Ninja Foodi DualZone,Foodi DualZone runs two zones at different temperatures simultaneously. Game changer for meal prep.,5,en,cooking_zones
gen-nin-0201-02cad5b9,amazon,https://amazon.com/review/GEN0201,AmazonGenReviewer201,2026-03-06T17:00:00Z,2026-03-06T20:00:00Z,ninja,air_fryer,Ninja Foodi DualZone,DualZone sync finish feature is brilliant. Both baskets done at exactly the same time.,5,en,cooking_zones
gen-nin-0202-98a17730,trustpilot,https://trustpilot.com/review/ninja/gen202,TPGenReviewer202,2026-03-07T18:00:00Z,2026-03-07T21:00:00Z,ninja,air_fryer,Ninja Foodi DualZone,DualZone capacity is perfect for a family of 4. Never need the oven anymore.,5,en,capacity
gen-nin-0203-cd5197b3,youtube,https://youtube.com/watch?v=gen0203&lc=001,YTGenCommenter203,2026-03-08T19:00:00Z,2026-03-08T22:00:00Z,ninja,air_fryer,Ninja Foodi DualZone,DualZone takes up a lot of counter space. Measure your counter before buying.,3,en,size
gen-nin-0204-7aa2d6ac,reddit,https://reddit.com/r/sharkninja/comments/gen204,u/GenUser204,2026-03-09T08:00:00Z,2026-03-09T11:00:00Z,ninja,air_fryer,Ninja Foodi DualZone,DualZone fan is loud on full blast but quieter than expected for the power.,3,en,noise
gen-nin-0205-d56f0391,amazon,https://amazon.com/review/GEN0205,AmazonGenReviewer205,2026-03-10T09:00:00Z,2026-03-10T12:00:00Z,ninja,air_fryer,Ninja Foodi DualZone,DualZone baskets are dishwasher safe. Cleanup is the easiest part of this appliance.,5,en,cleaning
gen-nin-0206-bc4cae8f,trustpilot,https://trustpilot.com/review/ninja/gen206,TPGenReviewer206,2026-03-11T10:00:00Z,2026-03-11T13:00:00Z,ninja,air_fryer,Ninja Foodi DualZone,DualZone temperature accuracy is excellent. Meats come out perfectly every time.,5,en,temperature
gen-nin-0207-0abfa010,twitter,https://twitter.com/user/status/gen207,@GenTweetUser207,2026-03-12T11:00:00Z,2026-03-12T14:00:00Z,ninja,air_fryer,Ninja Foodi DualZone,DualZone preheat time is fast. Ready in 3 minutes versus 15 for a conventional oven.,5,en,preheat
gen-nin-0208-f4b78dc8,reddit,https://reddit.com/r/sharkninja/comments/gen208,u/GenUser208,2026-03-13T12:00:00Z,2026-03-13T15:00:00Z,ninja,air_fryer,Ninja Foodi DualZone,DualZone control panel is intuitive once you read the manual.,4,en,controls
gen-nin-0209-666b8e2e,amazon,https://amazon.com/review/GEN0209,AmazonGenReviewer209,2026-03-14T13:00:00Z,2026-03-14T16:00:00Z,ninja,air_fryer,Ninja Foodi DualZone,DualZone basket coating starting to peel after 6 months. Contact Ninja support now.,2,en,durability
gen-nin-0210-3fb13934,youtube,https://youtube.com/watch?v=gen0210&lc=001,YTGenCommenter210,2026-03-15T14:00:00Z,2026-03-15T17:00:00Z,ninja,air_fryer,Ninja Foodi DualZone,DualZone dehydrate function works great for jerky and herbs.,5,en,cooking_zones
gen-nin-0211-4606c4ca,trustpilot,https://trustpilot.com/review/ninja/gen211,TPGenReviewer211,2026-03-16T15:00:00Z,2026-03-16T18:00:00Z,ninja,air_fryer,Ninja Foodi DualZone,DualZone crisps frozen food like nothing else. Fries come out better than restaurant.,5,en,temperature
gen-nin-0212-a95420f0,reddit,https://reddit.com/r/sharkninja/comments/gen212,u/GenUser212,2026-03-17T16:00:00Z,2026-03-17T19:00:00Z,ninja,ice_cream_maker,Ninja Creami,Creami makes incredible ice cream from frozen bases. Texture is legitimately smooth.,5,en,texture
gen-nin-0213-459a518a,amazon,https://amazon.com/review/GEN0213,AmazonGenReviewer213,2026-03-18T17:00:00Z,2026-03-18T20:00:00Z,ninja,ice_cream_maker,Ninja Creami,Creami sorbet mode handles fruit bases beautifully. No ice chunks ever.,5,en,texture
gen-nin-0214-85228d58,trustpilot,https://trustpilot.com/review/ninja/gen214,TPGenReviewer214,2026-03-19T18:00:00Z,2026-03-19T21:00:00Z,ninja,ice_cream_maker,Ninja Creami,Creami motor is loud but the results are worth it. 2 minutes of noise for premium ice cream.,4,en,noise
gen-nin-0215-ee3f22c3,youtube,https://youtube.com/watch?v=gen0215&lc=001,YTGenCommenter215,2026-03-20T19:00:00Z,2026-03-20T22:00:00Z,ninja,ice_cream_maker,Ninja Creami,"Creami pint container is small. Fine for 1-2 servings, not for parties.",3,en,capacity
gen-nin-0216-112e8a29,reddit,https://reddit.com/r/sharkninja/comments/gen216,u/GenUser216,2026-03-21T08:00:00Z,2026-03-21T11:00:00Z,ninja,ice_cream_maker,Ninja Creami,Creami light ice cream setting is perfect for protein ice cream recipes.,5,en,texture
gen-nin-0217-78c80a53,amazon,https://amazon.com/review/GEN0217,AmazonGenReviewer217,2026-03-22T09:00:00Z,2026-03-22T12:00:00Z,ninja,ice_cream_maker,Ninja Creami,Creami motor burned out after 8 months. Replacement unit shipped quickly from Ninja.,2,en,durability
gen-nin-0218-373a8b19,twitter,https://twitter.com/user/status/gen218,@GenTweetUser218,2026-03-23T10:00:00Z,2026-03-23T13:00:00Z,ninja,ice_cream_maker,Ninja Creami,Creami mix-in function works by re-spinning — genius design for add-ins.,5,en,texture
gen-nin-0219-5f6f999b,trustpilot,https://trustpilot.com/review/ninja/gen219,TPGenReviewer219,2026-03-24T11:00:00Z,2026-03-24T14:00:00Z,ninja,ice_cream_maker,Ninja Creami,Creami base needs 24 hours to freeze properly. Plan ahead or you'll be disappointed.,3,en,process
gen-nin-0220-5102cbb7,reddit,https://reddit.com/r/sharkninja/comments/gen220,u/GenUser220,2026-03-25T12:00:00Z,2026-03-25T15:00:00Z,ninja,ice_cream_maker,Ninja Creami,Creami container is easy to clean. Dishwasher safe on top rack.,5,en,cleaning
gen-nin-0221-961a1514,youtube,https://youtube.com/watch?v=gen0221&lc=001,YTGenCommenter221,2026-03-26T13:00:00Z,2026-03-26T16:00:00Z,ninja,ice_cream_maker,Ninja Creami,Creami is the only machine that gives me commercial-quality results at home.,5,en,texture
gen-nin-0222-ad88d57e,amazon,https://amazon.com/review/GEN0222,AmazonGenReviewer222,2026-03-27T14:00:00Z,2026-03-27T17:00:00Z,ninja,ice_cream_maker,Ninja Creami,Creami display scratches easily. Minor complaint for a great machine.,3,en,durability
gen-nin-0223-0d2ef8ab,reddit,https://reddit.com/r/sharkninja/comments/gen223,u/GenUser223,2026-03-28T15:00:00Z,2026-03-28T18:00:00Z,ninja,coffee,Ninja Espresso Bar,Espresso Bar extracts a genuinely good espresso shot. Crema is present and consistent.,5,en,espresso
gen-nin-0224-798e7e88,amazon,https://amazon.com/review/GEN0224,AmazonGenReviewer224,2026-03-29T16:00:00Z,2026-03-29T19:00:00Z,ninja,coffee,Ninja Espresso Bar,Espresso Bar steam wand reaches temperature fast. Microfoam is excellent for latte art.,5,en,steam_wand
gen-nin-0225-0d3f8308,trustpilot,https://trustpilot.com/review/ninja/gen225,TPGenReviewer225,2026-03-30T17:00:00Z,2026-03-30T20:00:00Z,ninja,coffee,Ninja Espresso Bar,Espresso Bar grinder is built-in and quiet for a burr grinder.,4,en,grinder
gen-nin-0226-17cd00e0,youtube,https://youtube.com/watch?v=gen0226&lc=001,YTGenCommenter226,2026-03-31T18:00:00Z,2026-03-31T21:00:00Z,ninja,coffee,Ninja Espresso Bar,Espresso Bar descaling mode is easy to run. Notification system tells you when it's due.,5,en,descale
gen-nin-0227-0ce8d130,reddit,https://reddit.com/r/sharkninja/comments/gen227,u/GenUser227,2026-04-01T19:00:00Z,2026-04-01T22:00:00Z,ninja,coffee,Ninja Espresso Bar,Espresso Bar pod compatibility is limited. Only works with Nespresso Originalline.,3,en,pod
gen-nin-0228-2916189e,amazon,https://amazon.com/review/GEN0228,AmazonGenReviewer228,2026-04-02T08:00:00Z,2026-04-02T11:00:00Z,ninja,coffee,Ninja Espresso Bar,Espresso Bar water tank is generous. Fill once for a week of daily espressos.,5,en,capacity
gen-nin-0229-a063f5aa,trustpilot,https://trustpilot.com/review/ninja/gen229,TPGenReviewer229,2026-04-03T09:00:00Z,2026-04-03T12:00:00Z,ninja,coffee,Ninja Espresso Bar,Espresso Bar carafe mode brews 4 cups at once. Great for hosting.,5,en,carafe
gen-nin-0230-3b2185fd,twitter,https://twitter.com/user/status/gen230,@GenTweetUser230,2026-04-04T10:00:00Z,2026-04-04T13:00:00Z,ninja,coffee,Ninja Espresso Bar,Espresso Bar steam wand drips slightly after use. Minor annoyance.,3,en,steam_wand
gen-nin-0231-a9eb1bdd,reddit,https://reddit.com/r/sharkninja/comments/gen231,u/GenUser231,2026-04-05T11:00:00Z,2026-04-05T14:00:00Z,ninja,coffee,Ninja Espresso Bar,Espresso Bar temperature setting lets me dial in extraction perfectly.,5,en,temperature
gen-nin-0232-e74a7ccb,youtube,https://youtube.com/watch?v=gen0232&lc=001,YTGenCommenter232,2026-04-06T12:00:00Z,2026-04-06T15:00:00Z,ninja,coffee,Ninja Espresso Bar,Espresso Bar dial controls feel premium. Much better than digital buttons.,5,en,controls
gen-nin-0233-15cfe15b,reddit,https://reddit.com/r/sharkninja/comments/gen233,u/GenUser233,2026-04-07T13:00:00Z,2026-04-07T16:00:00Z,ninja,coffee,Ninja Coffee Bar,Coffee Bar brews a full carafe in 8 minutes. Speed is unmatched in its class.,5,en,brew_speed
gen-nin-0234-6bcc02b8,amazon,https://amazon.com/review/GEN0234,AmazonGenReviewer234,2026-04-08T14:00:00Z,2026-04-08T17:00:00Z,ninja,coffee,Ninja Coffee Bar,Coffee Bar rich mode concentrate is perfect for iced coffee drinks.,5,en,temperature
gen-nin-0235-a04cb531,trustpilot,https://trustpilot.com/review/ninja/gen235,TPGenReviewer235,2026-04-09T15:00:00Z,2026-04-09T18:00:00Z,ninja,coffee,Ninja Coffee Bar,Coffee Bar carafe keeps coffee hot for 4 hours. Better than my old machine.,5,en,carafe
gen-nin-0236-ac672b61,youtube,https://youtube.com/watch?v=gen0236&lc=001,YTGenCommenter236,2026-02-10T16:00:00Z,2026-02-10T19:00:00Z,ninja,coffee,Ninja Coffee Bar,Coffee Bar thermal carafe is the right choice. No burnt taste from hot plate.,5,en,temperature
gen-nin-0237-c3375ba8,reddit,https://reddit.com/r/sharkninja/comments/gen237,u/GenUser237,2026-02-11T17:00:00Z,2026-02-11T20:00:00Z,ninja,coffee,Ninja Coffee Bar,Coffee Bar descale alert came on after 3 months. Easy process but unexpected frequency.,3,en,descale
gen-nin-0238-a7b9c3ac,amazon,https://amazon.com/review/GEN0238,AmazonGenReviewer238,2026-02-12T18:00:00Z,2026-02-12T21:00:00Z,ninja,coffee,Ninja Coffee Bar,Coffee Bar over-ice setting is incredible. Coffee chills perfectly without diluting.,5,en,temperature
gen-nin-0239-0f839df8,twitter,https://twitter.com/user/status/gen239,@GenTweetUser239,2026-02-13T19:00:00Z,2026-02-13T22:00:00Z,ninja,coffee,Ninja Coffee Bar,Coffee Bar pod and grounds compatibility is the best feature. Ultimate flexibility.,5,en,pod
gen-nin-0240-83a2e465,trustpilot,https://trustpilot.com/review/ninja/gen240,TPGenReviewer240,2026-02-14T08:00:00Z,2026-02-14T11:00:00Z,ninja,coffee,Ninja Coffee Bar,Coffee Bar warming plate cracked after 1 year. Replacement part available but frustrating.,2,en,durability
gen-nin-0241-1617e077,reddit,https://reddit.com/r/sharkninja/comments/gen241,u/GenUser241,2026-02-15T09:00:00Z,2026-02-15T12:00:00Z,ninja,coffee,Ninja Coffee Bar,Coffee Bar frother makes decent foam. Not cafe quality but good enough for home.,4,en,steam_wand
gen-nin-0242-27bf4378,youtube,https://youtube.com/watch?v=gen0242&lc=001,YTGenCommenter242,2026-02-16T10:00:00Z,2026-02-16T13:00:00Z,ninja,coffee,Ninja Coffee Bar,Coffee Bar program settings are intuitive. Set it and forget it for morning routine.,5,en,controls
gen-nin-0600-7c31c4af,reddit,https://reddit.com/r/sharkninja/comments/gen600,u/GenUser600,2026-03-22T08:00:00Z,2026-03-22T11:00:00Z,ninja,air_fryer,Ninja Foodi DualZone,DualZone french fry results are restaurant quality every single time.,5,en,temperature
gen-nin-0601-65a8fa31,amazon,https://amazon.com/review/GEN0601,AmazonGenReviewer601,2026-03-23T09:00:00Z,2026-03-23T12:00:00Z,ninja,air_fryer,Ninja Foodi DualZone,DualZone timer beep is satisfying. Clear audio cue when cooking completes.,4,en,controls
gen-nin-0602-d0aff59e,trustpilot,https://trustpilot.com/review/ninja/gen602,TPGenReviewer602,2026-03-24T10:00:00Z,2026-03-24T13:00:00Z,ninja,air_fryer,Ninja Foodi DualZone,DualZone heat recovery between batches is fast. Efficient for batch cooking.,5,en,preheat
gen-nin-0603-1387dd23,youtube,https://youtube.com/watch?v=gen0603&lc=001,YTGenCommenter603,2026-03-25T11:00:00Z,2026-03-25T14:00:00Z,ninja,air_fryer,Ninja Foodi DualZone,DualZone warranty support replaced my unit within 5 days of filing claim.,5,en,durability
gen-nin-0604-ebbf299f,twitter,https://twitter.com/user/status/gen604,@GenTweetUser604,2026-03-26T12:00:00Z,2026-03-26T15:00:00Z,ninja,air_fryer,Ninja Foodi DualZone,DualZone saves me so much time versus the oven. Use it daily for dinner.,5,en,cooking_zones
gen-nin-0605-73e9e9cd,reddit,https://reddit.com/r/sharkninja/comments/gen605,u/GenUser605,2026-03-27T13:00:00Z,2026-03-27T16:00:00Z,ninja,ice_cream_maker,Ninja Creami,Creami freezing requirement is the only inconvenience. Results justify the wait.,4,en,process
gen-nin-0606-7758459c,amazon,https://amazon.com/review/GEN0606,AmazonGenReviewer606,2026-03-28T14:00:00Z,2026-03-28T17:00:00Z,ninja,ice_cream_maker,Ninja Creami,Creami protein ice cream mode is perfect for fitness-focused eating.,5,en,texture
gen-nin-0607-f17a8e13,trustpilot,https://trustpilot.com/review/ninja/gen607,TPGenReviewer607,2026-03-29T15:00:00Z,2026-03-29T18:00:00Z,ninja,ice_cream_maker,Ninja Creami,Creami sorbet is smoother than anything I've made with traditional ice cream makers.,5,en,texture
gen-nin-0608-8568e766,reddit,https://reddit.com/r/sharkninja/comments/gen608,u/GenUser608,2026-03-30T16:00:00Z,2026-03-30T19:00:00Z,ninja,coffee,Ninja Espresso Bar,Espresso Bar shot extraction time is adjustable. Advanced user feature I love.,5,en,espresso
gen-nin-0609-67041cc0,amazon,https://amazon.com/review/GEN0609,AmazonGenReviewer609,2026-03-31T17:00:00Z,2026-03-31T20:00:00Z,ninja,coffee,Ninja Espresso Bar,Espresso Bar milk frother makes excellent cappuccino foam.,5,en,steam_wand
gen-nin-0610-22ad073c,trustpilot,https://trustpilot.com/review/ninja/gen610,TPGenReviewer610,2026-04-01T18:00:00Z,2026-04-01T21:00:00Z,ninja,coffee,Ninja Coffee Bar,Coffee Bar scheduled brew function works flawlessly every morning.,5,en,brew_speed
gen-nin-0611-0dba8aa0,youtube,https://youtube.com/watch?v=gen0611&lc=001,YTGenCommenter611,2026-04-02T19:00:00Z,2026-04-02T22:00:00Z,ninja,coffee,Ninja Coffee Bar,Coffee Bar over-ice brew is the best way to make cold brew at home.,5,en,temperature
gen-nin-0612-e177313e,twitter,https://twitter.com/user/status/gen612,@GenTweetUser612,2026-04-03T08:00:00Z,2026-04-03T11:00:00Z,ninja,coffee,Ninja Coffee Bar,Coffee Bar specialty brew modes cover everything from espresso-style to tea.,5,en,controls
gen-nin-0850-973d879f,reddit,https://reddit.com/r/sharkninja/comments/gen850,u/GenUser850,2026-03-16T18:00:00Z,2026-03-16T21:00:00Z,ninja,air_fryer,Ninja Foodi DualZone,DualZone reheat mode is a killer feature for batch cooking and meal prep.,5,en,cooking_zones
gen-nin-0851-e6fc7e33,amazon,https://amazon.com/review/GEN0851,AmazonGenReviewer851,2026-03-17T19:00:00Z,2026-03-17T22:00:00Z,ninja,air_fryer,Ninja Foodi DualZone,DualZone handles steak perfectly with the right time and temp settings.,5,en,temperature
gen-nin-0852-9030acf5,trustpilot,https://trustpilot.com/review/ninja/gen852,TPGenReviewer852,2026-03-18T08:00:00Z,2026-03-18T11:00:00Z,ninja,air_fryer,Ninja Foodi DualZone,DualZone energy consumption is notably less than using the oven.,5,en,cooking_zones
gen-nin-0853-0a5fc42d,youtube,https://youtube.com/watch?v=gen0853&lc=001,YTGenCommenter853,2026-03-19T09:00:00Z,2026-03-19T12:00:00Z,ninja,ice_cream_maker,Ninja Creami,Creami texture processing is consistent across all preset modes.,5,en,texture
gen-nin-0854-d5611a00,reddit,https://reddit.com/r/sharkninja/comments/gen854,u/GenUser854,2026-03-20T10:00:00Z,2026-03-20T13:00:00Z,ninja,ice_cream_maker,Ninja Creami,Creami desserts come out lighter than traditional ice cream. Impressive tech.,5,en,texture
gen-nin-0855-d3a6a9e7,amazon,https://amazon.com/review/GEN0855,AmazonGenReviewer855,2026-03-21T11:00:00Z,2026-03-21T14:00:00Z,ninja,coffee,Ninja Espresso Bar,Espresso Bar espresso tastes comparable to professional cafe espresso.,5,en,espresso
gen-nin-0856-62c775b8,trustpilot,https://trustpilot.com/review/ninja/gen856,TPGenReviewer856,2026-03-22T12:00:00Z,2026-03-22T15:00:00Z,ninja,coffee,Ninja Coffee Bar,"Coffee Bar coffee temperature is ideal. Not too hot, not too cold.",5,en,temperature
gen-nin-0857-55402069,youtube,https://youtube.com/watch?v=gen0857&lc=001,YTGenCommenter857,2026-03-23T13:00:00Z,2026-03-23T16:00:00Z,ninja,coffee,Ninja Coffee Bar,Coffee Bar weekly clean reminder keeps the machine in top condition.,5,en,descale
